{
  "schemaVersion": 1,
  "id": "lesson28",
  "title": "Lesson 28 - Ma- Verbs OF",
  "vocabulary": [
    {
      "tagalog": "makita",
      "english": "to see something (OF(O), OF(a))",
      "required": true,
      "audioPath": "17e56f8b-b031-484a-ac65-74ec7cf3926d"
    },
    {
      "tagalog": "maalala",
      "english": "to remember something (OF(O), OF(a))",
      "required": true,
      "audioPath": "8e7a71d5-a740-4ef1-86b0-96e1dca312c5"
    },
    {
      "tagalog": "maisip",
      "english": "to think of something (OF(O), OF(a))",
      "required": true,
      "audioPath": "47241b2a-f847-4629-8951-d20009965eb3"
    },
    {
      "tagalog": "masabi",
      "english": "to be able to say something (OF(O), OF(a))",
      "required": true,
      "audioPath": "b1ef0f7e-b429-431e-80b8-ef1eddec3c32"
    },
    {
      "tagalog": "makuha",
      "english": "to be able to get something (OF(O), OF(a))",
      "required": true,
      "audioPath": "6fc0c2b1-e376-4643-b792-6f11dd35862a"
    }
  ],
  "contents": [
    {
      "type": "p",
      "markdown": "The previous lesson covered AF _ma_- verbs. This one covers OF _ma_- verbs."
    },
    {
      "type": "h3",
      "markdown": "<u>Traits of OF ma- verbs</u>"
    },
    {
      "type": "p",
      "markdown": "The only variant is OF(O)."
    },
    {
      "type": "p",
      "markdown": "These do not form imperatives."
    },
    {
      "type": "p",
      "markdown": "They may have the nuance OF(a), which means “to be able” to do something, they may have the nuance of doing something unintentionally, and they may have neither of these nuances depending on context."
    },
    {
      "type": "p",
      "markdown": "Some are used for sensing something."
    },
    {
      "type": "p",
      "markdown": "In the vocabulary list, you may be wondering why all definitions show the OF(a) variant, but only two verbs have “to be able” in the written definition. That is because those two verbs are primarily used as OF(a), and when OF(a) is not needed, a different verb type is used. For example, _makita_ may mean “to be able to see something” or just “to see something”. _Masabi_, on the other hand, primarily means “to be able to say something”, and an -_in_ verb is used for “to say something”."
    },
    {
      "type": "sentence",
      "item": {
        "tagalog": "Makikita ko si Maria. =",
        "english": "I will see Maria (sensing), or I will be able to see Maria (to be able).",
        "required": true,
        "audioPath": "6181163e-7d00-42d2-b2da-494e13dc188f"
      }
    },
    {
      "type": "sentence",
      "item": {
        "tagalog": "Nakukuha ng lalaki ang mangga.",
        "english": "The man is able to get the mango (to be able).",
        "required": true,
        "audioPath": "7af42689-6c86-42a5-b346-4e1b611db714"
      }
    },
    {
      "type": "sentence",
      "item": {
        "tagalog": "Naisip ni David ang anak niya.",
        "english": "David thought about his child (sensing), or David happened to think about his child (unintentional).",
        "required": true,
        "audioPath": "14d223af-bafa-45ee-ae85-e4f468f39e40"
      }
    },
    {
      "type": "h3",
      "markdown": "<u>Standard Sentence</u>"
    },
    {
      "type": "p",
      "markdown": "These are OF(O) verbs, so as a reminder:"
    }
  ],
  "exampleSentences": [
    {
      "tagalog": "Sino ang nakita ni Analyn sa tindahan nung alas siyete ng umaga?",
      "english": "Who did Analyn see at the store at 7am?",
      "required": true,
      "audioPath": "c8d75ead-5063-48c2-ac0a-03f0017292fa"
    },
    {
      "tagalog": "Naaalala ko ang pusa sa bahay ng aso ni Diego.",
      "english": "I remember the cat in Diego's dog's house.",
      "required": true,
      "audioPath": "de475d93-f838-408e-9408-74e3c7b705cb"
    },
    {
      "tagalog": "Maiisip ba niya ang pangalan ng babae?",
      "english": "Will he be able to think of the woman's name?",
      "required": true,
      "audioPath": "fc092650-9f7a-4687-b7d7-3dac0d63847d"
    },
    {
      "tagalog": "Nasabi ba ni Mrs. Cruz ang petsa kahapon?",
      "english": "Was Mrs. Cruz able to tell you the date yesterday?",
      "required": true,
      "audioPath": "d3432f25-9490-4563-a78a-585a9a459c71"
    },
    {
      "tagalog": "Nakukuha nina Maria at David ang lechon sa kuwartong yun.",
      "english": "Maria and David are able to get the grilled pig out of that room.",
      "required": true,
      "audioPath": "50b30dd6-46fd-4ca5-8728-aac617c5bca8"
    },
    {
      "tagalog": "Makikita po ninyo ang maraming puno sa Seattle sa Huwebes.",
      "english": "You (pl.) will be able to see the many trees in Seattle on Thursday.",
      "required": true,
      "audioPath": "8803dbe3-c36f-44db-b3f3-d1e71b224f83"
    },
    {
      "tagalog": "Naalala namin ang gurong namatay",
      "english": "We remembered the teacher who died..",
      "required": true,
      "audioPath": "246091a9-605e-4748-af77-a6b8dec4e5e3"
    },
    {
      "tagalog": "Ano ang naiisip ni Sir Bautista sa gabi?",
      "english": "What does Mr. Bautista think of at night?",
      "required": true,
      "audioPath": "c517aaf0-63b3-479a-a946-30f875c53bd2"
    },
    {
      "tagalog": "Magandang masabi ang totoo.",
      "english": "It is good the truth gets told unintentionally.",
      "required": true,
      "audioPath": "d59b35eb-6ebe-486c-9ed2-3c75cf1fa934"
    },
    {
      "tagalog": "Hindi nila makukuha ang mabilis na bata para sa iyo.",
      "english": "They will not be able to get the fast kid for you.",
      "required": true,
      "audioPath": "7787979e-cd4c-4544-ae78-4c5f4fc82163"
    }
  ]
}
